{
  "bootstrap_sha256": "a3aa775f6231b71f36ad7ec5950c369c40d76bc5340e478d064fbc1b0db12b22",
  "build_tool_id": "patent-analysis.renderer-bundler",
  "build_tool_version": "1.0.0",
  "echarts_version": "6.1.0",
  "renderer_build_manifest_version": "1.0.0",
  "renderer_bundle_sha256": "6d58bc8a6cb0f2d3c20680557ce878b339b4b23a8e719bd92d2bbfa3977918c8",
  "renderer_protocol_version": "1.0.0"
}
