{
  "bootstrap_sha256": "2bde3bb8a25e2f565c234d1307880b13c92ff89260a3f1fc1e6d491593c7b7e2",
  "build_tool_id": "patent-analysis.renderer-bundler",
  "build_tool_version": "1.0.0",
  "echarts_version": "6.1.0",
  "renderer_build_manifest_version": "1.0.0",
  "renderer_bundle_sha256": "afba640e7e821639249bf15d24f663d468370d3bb0bfff80a4561830d93a60ad",
  "renderer_protocol_version": "1.0.0"
}
